{
 "$schema": "../schema/test.schema.json",
 "id": "practice-05",
 "title": "Fluova Practice Test 5",
 "version": "1.0.0",
 "license": "CC-BY-SA-4.0",
 "authors": [
  "Fluova contributors"
 ],
 "level": "real",
 "notes": "Spec-faithful test assembled from the question bank (all units new). Explanations in English, Turkish and Spanish.",
 "sections": [
  {
   "id": "reading",
   "name": "Reading",
   "minutes": 29,
   "intro": {
    "en": "Reading: Complete the Words, Read in Daily Life and Read an Academic Passage. After the first module the section adapts to you and gets harder or easier. Correct answers often do not repeat the words in the text; they say the same thing in other words.",
    "tr": "Reading: Complete the Words, Read in Daily Life ve Read an Academic Passage. İlk modülden sonra bölüm sana göre zorlaşır ya da kolaylaşır. Doğru cevaplar çoğu zaman metindeki kelimeleri tekrar etmez; anlamı başka sözcüklerle verir.",
    "es": "Reading: Complete the Words, Read in Daily Life y Read an Academic Passage. Después del primer módulo, la sección se adapta a ti y se vuelve más difícil o más fácil. Las respuestas correctas a menudo no repiten las palabras del texto: dicen lo mismo con otras palabras."
   },
   "screens": [
    {
     "type": "ctw",
     "title": "Complete the Words: Meandering rivers",
     "text": [
      "Rivers that flow across flat land rarely stay straight for long. Water {{p5_ctw_meandering_rivers_1}} faster {{p5_ctw_meandering_rivers_2}} the {{p5_ctw_meandering_rivers_3}} of a {{p5_ctw_meandering_rivers_4}}, so {{p5_ctw_meandering_rivers_5}} wears {{p5_ctw_meandering_rivers_6}} that {{p5_ctw_meandering_rivers_7}} and {{p5_ctw_meandering_rivers_8}} the {{p5_ctw_meandering_rivers_9}} soil {{p5_ctw_meandering_rivers_10}}. On the inside of the bend, the water slows down and drops sand and gravel. Over many years, this process makes each curve wider and pushes it slowly across the valley. Eventually two bends may meet, and the river takes the shorter path, leaving behind a curved lake."
     ],
     "items": [
      {
       "id": "p5_ctw_meandering_rivers_1",
       "stub": "mo",
       "answer": "ves"
      },
      {
       "id": "p5_ctw_meandering_rivers_2",
       "stub": "al",
       "answer": "ong"
      },
      {
       "id": "p5_ctw_meandering_rivers_3",
       "stub": "out",
       "answer": "side"
      },
      {
       "id": "p5_ctw_meandering_rivers_4",
       "stub": "be",
       "answer": "nd"
      },
      {
       "id": "p5_ctw_meandering_rivers_5",
       "stub": "i",
       "answer": "t"
      },
      {
       "id": "p5_ctw_meandering_rivers_6",
       "stub": "aw",
       "answer": "ay"
      },
      {
       "id": "p5_ctw_meandering_rivers_7",
       "stub": "ba",
       "answer": "nk"
      },
      {
       "id": "p5_ctw_meandering_rivers_8",
       "stub": "car",
       "answer": "ries"
      },
      {
       "id": "p5_ctw_meandering_rivers_9",
       "stub": "lo",
       "answer": "ose"
      },
      {
       "id": "p5_ctw_meandering_rivers_10",
       "stub": "downs",
       "answer": "tream"
      }
     ]
    },
    {
     "type": "ctw",
     "title": "Complete the Words: Flavor and smell",
     "text": [
      "Many people notice that food seems to lose its taste when they have a bad cold. The {{p5_ctw_flavor_and_smell_1}} can {{p5_ctw_flavor_and_smell_2}} only a {{p5_ctw_flavor_and_smell_3}} basic {{p5_ctw_flavor_and_smell_4}}, such {{p5_ctw_flavor_and_smell_5}} sweetness, {{p5_ctw_flavor_and_smell_6}} and {{p5_ctw_flavor_and_smell_7}}. Most {{p5_ctw_flavor_and_smell_8}} what {{p5_ctw_flavor_and_smell_9}} call {{p5_ctw_flavor_and_smell_10}} actually comes from smell, as tiny particles from food travel up the back of the throat to the nose. When the nose is blocked, those particles cannot reach the cells that sense them. As a result, an apple and a raw potato can taste surprisingly similar."
     ],
     "items": [
      {
       "id": "p5_ctw_flavor_and_smell_1",
       "stub": "ton",
       "answer": "gue"
      },
      {
       "id": "p5_ctw_flavor_and_smell_2",
       "stub": "det",
       "answer": "ect"
      },
      {
       "id": "p5_ctw_flavor_and_smell_3",
       "stub": "f",
       "answer": "ew"
      },
      {
       "id": "p5_ctw_flavor_and_smell_4",
       "stub": "qual",
       "answer": "ities"
      },
      {
       "id": "p5_ctw_flavor_and_smell_5",
       "stub": "a",
       "answer": "s"
      },
      {
       "id": "p5_ctw_flavor_and_smell_6",
       "stub": "salt",
       "answer": "iness"
      },
      {
       "id": "p5_ctw_flavor_and_smell_7",
       "stub": "bitte",
       "answer": "rness"
      },
      {
       "id": "p5_ctw_flavor_and_smell_8",
       "stub": "o",
       "answer": "f"
      },
      {
       "id": "p5_ctw_flavor_and_smell_9",
       "stub": "w",
       "answer": "e"
      },
      {
       "id": "p5_ctw_flavor_and_smell_10",
       "stub": "fla",
       "answer": "vor"
      }
     ]
    },
    {
     "type": "passage",
     "title": "Library notice: booking study rooms",
     "directions": "Read in Daily Life (notice)",
     "text": [
      "<strong>Group Study Rooms — Now Booked Through the Campus App</strong>",
      "Starting Monday, the paper sign-up sheets outside the group study rooms will be removed. Rooms can be reserved up to three days ahead in the Campus app, for a maximum of two hours a day per student. If your group has not arrived within fifteen minutes of the start time, the room will be released to anyone waiting. Students without a smartphone can ask the staff at the circulation desk to book a room for them."
     ],
     "questions": [
      {
       "id": "p5_dl_study_room_app_q1",
       "stem": "What is the notice mainly about?",
       "options": [
        "A new procedure for getting a place to work with classmates",
        "New opening hours for the library during exam weeks",
        "A plan to add more group study rooms to the library",
        "Rules about the noise level allowed in the group study rooms"
       ],
       "answer": 0,
       "why": {
        "en": "Main idea (paraphrase): rooms are now reserved in the app instead of on paper sheets. B, C and D bring in topics the notice never mentions (hours, new rooms, noise).",
        "tr": "Ana fikir (parafraz): odalar artık kâğıt listeler yerine uygulamadan ayırtılıyor. B, C ve D duyuruda hiç geçmeyen konular getiriyor (saatler, yeni odalar, gürültü).",
        "es": "Idea principal (paráfrasis): las salas ahora se reservan en la app en lugar de en hojas de papel. B, C y D introducen temas que el aviso no menciona (horarios, salas nuevas, ruido)."
       }
      },
      {
       "id": "p5_dl_study_room_app_q2",
       "stem": "A group reserved a room for 3:00 but arrives at 3:20. What will most likely happen?",
       "options": [
        "They will keep the room but lose twenty minutes of their time",
        "They will have to ask the circulation desk to extend the booking",
        "They may find that the room has been given to someone else",
        "They will not be allowed to book a room again that week"
       ],
       "answer": 2,
       "why": {
        "en": "Inference: a room is \"released to anyone waiting\" after fifteen minutes, so at 3:20 it may already be taken. A assumes the booking still stands; D invents a penalty the notice does not state.",
        "tr": "Çıkarım: on beş dakika içinde gelinmezse oda \"bekleyen herkese\" açılıyor; 3.20'de oda başkasına verilmiş olabilir. A rezervasyonun sürdüğünü varsayıyor; D duyuruda olmayan bir ceza uyduruyor.",
        "es": "Inferencia: la sala se \"libera para quien esté esperando\" a los quince minutos, así que a las 3:20 puede estar ocupada. A supone que la reserva sigue; D inventa una sanción que el aviso no menciona."
       }
      }
     ]
    },
    {
     "type": "passage",
     "title": "Email: tuition payment plan",
     "directions": "Read in Daily Life (email)",
     "text": [
      "<strong>From:</strong> Student Accounts Office<br><strong>To:</strong> Daniel Okafor<br><strong>Subject:</strong> Your payment plan request",
      "Dear Daniel, thank you for applying to pay this semester's tuition in installments. Your plan has been approved: the balance will be divided into four equal payments, due on the first day of each month from September to December. There is a one-time setup fee of $25, which will be added to your first payment. Please note that a payment more than ten days late will cancel the plan, and the full remaining balance will then be due at once.",
      "— Student Accounts Office"
     ],
     "questions": [
      {
       "id": "p5_dl_payment_plan_q1",
       "stem": "Why did the office write to Daniel?",
       "options": [
        "To confirm that his request to pay in parts was accepted",
        "To remind him that his first payment is already overdue",
        "To explain why his application for a payment plan was refused",
        "To ask him to choose how many payments he would like to make"
       ],
       "answer": 0,
       "why": {
        "en": "Purpose (paraphrase): \"Your plan has been approved.\" B is not stated: no payment is late yet. C reverses the decision; D is wrong because the office has already set four payments.",
        "tr": "Amaç (parafraz): \"Your plan has been approved.\" B metinde yok, henüz geciken bir ödeme yok. C kararı tersine çeviriyor; D yanlış, çünkü ofis dört taksiti zaten belirlemiş.",
        "es": "Propósito (paráfrasis): \"Your plan has been approved.\" B no se dice: todavía no hay ningún pago atrasado. C invierte la decisión; D es incorrecta porque la oficina ya fijó cuatro pagos."
       }
      },
      {
       "id": "p5_dl_payment_plan_q2",
       "stem": "What is true about the $25 fee?",
       "options": [
        "It is charged every month together with each payment",
        "It will be paid as part of the September payment",